{
  "id": "passport:git:github.com/omdsh-dev/ex-setting@46130b8d5f0c3784cb1325412fea0b116b37e9ae:scanner-2",
  "pluginId": "github:omdsh-dev/ex-setting",
  "versionId": "git:github.com/omdsh-dev/ex-setting@46130b8d5f0c3784cb1325412fea0b116b37e9ae",
  "scannerVersion": 2,
  "checkedAt": "2026-08-17T05:03:06Z",
  "trustState": "review_required",
  "manifest": {
    "hasBundle": true,
    "hasClient": false,
    "packageName": "@deepseek-ai/dsh-ex-setting",
    "subpath": null
  },
  "license": {
    "spdx": null,
    "file": "LICENSE"
  },
  "lifecycleScripts": [],
  "signals": {
    "network": [],
    "fs": [],
    "credentials": [],
    "dynamicEval": [],
    "uiHijack": []
  },
  "compatibility": {
    "dshRange": ">=0.1.0-rc.1 <0.2.0-0",
    "profiles": [
      "web"
    ],
    "desktop": "unknown"
  },
  "filesInspected": [
    "package.json",
    "cordis.patch.yml"
  ],
  "findings": [],
  "disclaimer": "Static evidence is not a complete audit and not a runtime sandbox."
}
