{
  "id": "passport:npm:dsh-web-notify@0.1.4:scanner-2",
  "pluginId": "github:renpengfei1027/dsh-web-notify",
  "versionId": "npm:dsh-web-notify@0.1.4",
  "scannerVersion": 2,
  "checkedAt": "2026-08-17T05:03:06Z",
  "trustState": "installable",
  "manifest": {
    "hasBundle": true,
    "hasClient": true,
    "packageName": "dsh-web-notify",
    "subpath": null
  },
  "license": {
    "spdx": "MIT",
    "file": "LICENSE"
  },
  "lifecycleScripts": [],
  "signals": {
    "network": [],
    "fs": [],
    "credentials": [],
    "dynamicEval": [],
    "uiHijack": []
  },
  "compatibility": {
    "dshRange": ">=0.1.0-rc.1 <0.2.0-0",
    "profiles": [
      "web"
    ],
    "desktop": "unknown"
  },
  "filesInspected": [
    "package.json",
    "cordis.patch.yml"
  ],
  "findings": [],
  "disclaimer": "Static evidence is not a complete audit and not a runtime sandbox."
}
