{
  "id": "passport:npm:@anionex/dsh-vision-toolkit@0.1.18:scanner-2",
  "pluginId": "github:Anionex/dsh-vision-toolkit",
  "versionId": "npm:@anionex/dsh-vision-toolkit@0.1.18",
  "scannerVersion": 2,
  "checkedAt": "2026-08-17T05:03:06Z",
  "trustState": "featured",
  "manifest": {
    "hasBundle": true,
    "hasClient": true,
    "packageName": "@anionex/dsh-vision-toolkit",
    "subpath": null
  },
  "license": {
    "spdx": "MIT",
    "file": "LICENSE"
  },
  "lifecycleScripts": [],
  "signals": {
    "network": [],
    "fs": [],
    "credentials": [],
    "dynamicEval": [],
    "uiHijack": []
  },
  "compatibility": {
    "dshRange": ">=0.1.0-rc.1 <0.2.0-0",
    "profiles": [
      "web"
    ],
    "desktop": "unknown"
  },
  "filesInspected": [
    "package.json",
    "cordis.patch.yml",
    "lib/index.js"
  ],
  "findings": [],
  "disclaimer": "Static evidence is not a complete audit and not a runtime sandbox."
}
