{
  "id": "passport:git:github.com/openma-ai/deepseek-harness-tui@0000000000000000000000000000000000000001:scanner-2",
  "pluginId": "github:openma-ai/deepseek-harness-tui",
  "versionId": "git:github.com/openma-ai/deepseek-harness-tui@0000000000000000000000000000000000000001",
  "scannerVersion": 2,
  "checkedAt": "2026-08-17T05:03:06Z",
  "trustState": "blocked",
  "manifest": {
    "hasBundle": false,
    "hasClient": false,
    "packageName": "deepseek-harness-tui",
    "subpath": null
  },
  "license": {
    "spdx": "MIT",
    "file": "LICENSE"
  },
  "lifecycleScripts": [],
  "signals": {
    "network": [],
    "fs": [],
    "credentials": [],
    "dynamicEval": [],
    "uiHijack": []
  },
  "compatibility": {
    "dshRange": ">=0.1.0-rc.1 <0.2.0-0",
    "profiles": [
      "headless"
    ],
    "desktop": "unknown"
  },
  "filesInspected": [
    "package.json"
  ],
  "findings": [
    {
      "id": "manifest-missing",
      "severity": "high",
      "label": {
        "zh": "未识别到有效的 dsh manifest",
        "en": "No valid dsh manifest found"
      },
      "files": [
        "package.json"
      ]
    }
  ],
  "disclaimer": "Static evidence is not a complete audit and not a runtime sandbox."
}
