{
  "id": "passport:npm:@dsh-store/fixture-client-only@0.0.1:scanner-2",
  "pluginId": "github:dsh-store/fixture-client-only",
  "versionId": "npm:@dsh-store/fixture-client-only@0.0.1",
  "scannerVersion": 2,
  "checkedAt": "2026-08-17T05:03:06Z",
  "trustState": "screened",
  "manifest": {
    "hasBundle": false,
    "hasClient": true,
    "packageName": "@dsh-store/fixture-client-only",
    "subpath": null
  },
  "license": {
    "spdx": "MIT",
    "file": "LICENSE"
  },
  "lifecycleScripts": [],
  "signals": {
    "network": [],
    "fs": [],
    "credentials": [],
    "dynamicEval": [],
    "uiHijack": []
  },
  "compatibility": {
    "dshRange": ">=0.1.0-rc.1 <0.2.0-0",
    "profiles": [
      "web"
    ],
    "desktop": "unknown"
  },
  "filesInspected": [
    "package.json"
  ],
  "findings": [],
  "disclaimer": "Static evidence is not a complete audit and not a runtime sandbox."
}
