{
  "id": "passport:git:github.com/lussey820/dsh-http-tools@fdc1b71738ac40a9fae0a5f6c02c81f7107f0a41:scanner-2",
  "pluginId": "github:lussey820/dsh-http-tools",
  "versionId": "git:github.com/lussey820/dsh-http-tools@fdc1b71738ac40a9fae0a5f6c02c81f7107f0a41",
  "scannerVersion": 2,
  "checkedAt": "2026-08-17T05:03:06Z",
  "trustState": "installable",
  "manifest": {
    "hasBundle": true,
    "hasClient": false,
    "packageName": "dsh-http-tools",
    "subpath": null
  },
  "license": {
    "spdx": "MIT",
    "file": "LICENSE"
  },
  "lifecycleScripts": [],
  "signals": {
    "network": [],
    "fs": [],
    "credentials": [],
    "dynamicEval": [],
    "uiHijack": []
  },
  "compatibility": {
    "dshRange": ">=0.1.0-rc.1 <0.2.0-0",
    "profiles": [
      "web"
    ],
    "desktop": "unknown"
  },
  "filesInspected": [
    "package.json",
    "cordis.patch.yml",
    "src/index.ts"
  ],
  "findings": [],
  "disclaimer": "Static evidence is not a complete audit and not a runtime sandbox."
}
