{
  "id": "passport:npm:dsh-web-ui@0.1.1:scanner-2",
  "pluginId": "github:zhu1090093659/dsh-web-ui",
  "versionId": "npm:dsh-web-ui@0.1.1",
  "scannerVersion": 2,
  "checkedAt": "2026-08-17T05:03:06Z",
  "trustState": "blocked",
  "manifest": {
    "hasBundle": false,
    "hasClient": false,
    "packageName": "dsh-web-ui",
    "subpath": null
  },
  "license": {
    "spdx": null,
    "file": "LICENSE"
  },
  "lifecycleScripts": [],
  "signals": {
    "network": [],
    "fs": [],
    "credentials": [],
    "dynamicEval": [],
    "uiHijack": []
  },
  "compatibility": {
    "dshRange": ">=0.1.0-rc.1 <0.2.0-0",
    "profiles": [
      "web"
    ],
    "desktop": "unknown"
  },
  "filesInspected": [
    "package.json",
    "cordis.patch.yml"
  ],
  "findings": [
    {
      "id": "manifest-missing",
      "severity": "high",
      "label": {
        "zh": "未识别到有效的 dsh manifest",
        "en": "No valid dsh manifest found"
      },
      "files": [
        "package.json"
      ]
    }
  ],
  "disclaimer": "Static evidence is not a complete audit and not a runtime sandbox."
}
