{
  "id": "passport:git:github.com/slywalker2006/dsh-passwords@90493d3b1a22d24326480180eac753cbf91ac817:scanner-2",
  "pluginId": "github:slywalker2006/dsh-passwords",
  "versionId": "git:github.com/slywalker2006/dsh-passwords@90493d3b1a22d24326480180eac753cbf91ac817",
  "scannerVersion": 2,
  "checkedAt": "2026-08-17T05:03:06Z",
  "trustState": "installable",
  "manifest": {
    "hasBundle": true,
    "hasClient": false,
    "packageName": "dsh-passwords",
    "subpath": null
  },
  "license": {
    "spdx": "MIT",
    "file": "LICENSE"
  },
  "lifecycleScripts": [],
  "signals": {
    "network": [],
    "fs": [],
    "credentials": [],
    "dynamicEval": [],
    "uiHijack": []
  },
  "compatibility": {
    "dshRange": ">=0.1.0-rc.1 <0.2.0-0",
    "profiles": [
      "web"
    ],
    "desktop": "unknown"
  },
  "filesInspected": [
    "package.json",
    "cordis.patch.yml"
  ],
  "findings": [],
  "disclaimer": "Static evidence is not a complete audit and not a runtime sandbox."
}
